Address,City,Country,Customer ID,Name,Notes,Phone,State,Zip
123 Main Street,Seattle,United States,1,Tres Delicious,"High maintenance, not sure if it's worth having them as a customer, but don't tell them that!",999-999-9999,WA,98112
1521 Redbud Drive,Huntington,United States,4,Wholesome Foods,"CEO has three kids, first one is Charles, don't know the rest. CEO cares about Charles the most, so all good.",347-789-7688,NY,11743
2217 Lonely Oak Drive,Mobile,United States,5,Park & Shop Convenience Stores,"New customer, make sure to please them!",251-655-2909,AL,36602
3215 Tori Lane,Salt Lake City,United States,2,ABC Groceries,"Friendly but a little old school. Talks way too much, set a time limit on calls.",801-583-8695,UT,84113
4660 Sycamore Lake Road,Green Bay,United States,3,ACME Bites,One of our best customers! Likes to talk about sports.,920-419-6270,WI,54303
